Unnamed: 0,split,topic,label,TEXT
2813,train,region,0,凡是讨论到教育、高考的地方总会有人出来冷嘲热讽北京教育资源丰厚，轻轻松松上985211甚至清北什么的。虽然完全理解高考大省竞争激烈考到首都不易，但北京学生招谁惹谁了 就因为所谓 既得利益者站着说话不腰疼 就要被莫名其妙攻击吗
3206,train,gender,1,不是好东西先欺负男的所以活该
10151,train,race,0,今天范范和黑人结婚了 幸福的冒泡啊
7461,train,race,1,毁灭你与你何干？所以说只要别来中国，他们怎么样都行，我们救不了，至于你们说的嫁给黑人的问题，这是没有办法的，只要接触都有一定的可能，不管几率有多小，总有人会脑子抽筋，中国人口基数太大，这是一个概率性的问题
6535,train,region,0,老内斗了没办法，要我说苏州河以北全是苏北
3038,train,region,1,苏南苏北地域歧视，南蛮北侉，江苏人都知道
4029,train,gender,0,如果儿子女儿都说话客了，她怎么选
6764,train,race,1,我歧视的是懒惰，贪婪，愚昧，迷信，自私的人，与他是黄种人，黑人，还是白人无关，巧的是大多数黑人全占了
9085,train,race,0,同理，印度人喝牛尿、非洲巫师驱鬼治病也有他们的体系，也是合理的。
2939,train,gender,0,认识过两个拉拉，现在都没有联系了。
4457,train,region,0,你错了，这种人在浙江很多，我爸就是。当年遇到一个来宁波寻亲，钱被摸光的人。我爸接待他吃饭，给他地方住，还给了他回家的路费。最后，那个人确实把钱寄回来了
2185,train,region,1,所以不要把其中一方艺术创作成多么委屈多么善良的，说什么狗是人类最好的朋友，真恶心，我在上海陆家嘴看到狗屎，在杭州居民区经常看到流浪狗，这又是谁的锅?
907,train,region,1,我看到很多台湾人说我们分不清国家和zf的概念，因为我们被洗脑成这两个是绑定在一起的[为难]你们两党那么垃圾，当然和你们那破流亡政权不能绑在一起了，虽然挺般配的
540,train,region,1,我看了一下这样的话：你们东北人都挺能喝吧，你们东北是不是都不吃米饭啊，你们东北人是不是都会二人转啊，你们东北是不是挺多黑社会啊……觉得并没有尴尬到脸酸，算了，不加进去了，但是我不能白写，哈哈
3918,train,race,1,"看到大多数回答都是说日本人怎么怎么看不起中国人，突然想到了刚来日本的不久时，买电车票的时候不小心按到呼び出し（按一下，就会有工作人员出来询问什么事的按钮），而被工作人员骂过。打工被教训过，气不过，第二天就没去了。,我想，"
4980,train,region,0,中国，香港，澳门，台湾在一组，大乱斗
3330,train,region,0,当评论没看过霹雳的吗。。p的官方辟谣，那是你们冲到人台湾道友自创号下边私信，人家没听过魔道祖师这玩意儿，你们就当辟谣圣旨给裱上了
1083,train,region,1,昨天 世界里碰到的也是三个台湾人 他们问兄弟可以说话吗 我开麦说可以 然后他们听到我不是台湾口音 问我 兄弟你那里人 我就说大陆的 他们就问我哪个地方 我说南方一个小城市 他们直接就说不和穷逼玩 我可mmp了
4022,train,region,0,不不不，我不同意，倒数第一是黑龙江，请让我们坚守自己的本分，安安静静的当自己的倒第一，辽宁大兄弟不许抢！
3440,train,region,0,你这上图片过分了…偷摸告诉你，在吉林，吃串往东走[调皮]
908,train,region,1,别说一个公众人物了，哪怕是普通老百姓到国外旅游作出什么没素质的事，也可以称得上在外丢人现眼了。 不过他一台湾人，还是算了吧，现在没几个台湾年轻人真认为自己是中国人的，聪明点的不公开表示立场而已。
12119,train,race,0,不不 非洲的黑人有7-8个族群，有些特别矮（俾格米），有的前凸后翘（那种短跑的），有些很高但是瘦麻杆似得（擅长长跑），黑肤色都有很多梯度，鼻子也有挺的，和超级塌的
2639,train,race,0,"特别是黑人, 哈哈"
4412,train,region,0,现在还好吧，江苏人表示周围外地媳妇多，远嫁的姑娘少 ，还有出门打拼，结婚后定居外地的
11126,train,race,0,说英语的印度人是那一亿真正的人
796,train,gender,0,这件本来就是snidel一款衣服的仿版啊 snidel就是做仙女风的
421,train,gender,0,风女:我998不能呼吸
3213,train,region,0,四川人总以为自己nb的不行，可能是大山围着看不清外面的世界。这个答主自己回去看看国宴都用的什么菜，大老板谈生意点什么菜再bb吧。说白了，川菜就是平常老百姓解馋用的，高堂之上只有高端菜才能上桌。
11907,train,race,0,我们大学杯赛，有个黑人为主的留学生队伍也是一路碾压过去，然而他们的缺点是战术意识不强，还会内讧，最后决赛输给了有好几个校队队员的学员。
10167,train,race,0,学校有2人间，空调冰箱沙发，可惜都不是黄种人可以拥有的
2746,train,gender,1,当我发现我作为一个男性支持男女平等在某些人看来居然不是天经地义的时候?
4200,train,race,1,老黑：打架是不可能打架的，这辈子都不可能打架的，抢银行又不会抢，就是吓唬吓唬亚裔才能维持的了生活这样子。看见中国人就像看见爸爸一样，个个都是李小龙，打架又厉害，我超怕中国人的 (꒪Д꒪)ノ
1805,train,region,0,我也是四川的，，，问个问题咯，160妹子，在东北，是不是超级矮。。。
4965,train,race,1,我们中国不都是大大方方地歧视黑人嘛。
3585,train,region,1,我不清楚当年什么情况，是否偷井盖的人河南籍很多，所以我不说这样的话。如果有，随意调侃。。
1390,train,gender,1,女人就是犯贱
1989,train,region,0,河南人招你惹你了？
9623,train,race,0,我不会变法 即便看到不合理，和印度人民一起享受这种文化的福利[蹲]
903,train,race,0,我喜欢偏欧美风的亚裔博主 推荐jenn im和Amiee Song ins上搜imjennim和songofstyle就可以了
12101,train,race,0,收WJBXL 浙江3三门湾可以转的区来mmm 总灵180到190的来 化腾446135805 黑人勿扰
2657,train,gender,1,女的打人不叫殴打，男的打人才算？您可真是祖国未来的好警察呢[语塞]挂着警察学院头衔公然信口雌黄可还行，算侮辱吗
460,train,gender,0,答主你好！请问摆放那种白色的女佣好不好，啤酒瓶高像是石膏材质，造型还是很美。还有唐代天王像、家里过世老人的像怎么样？谢谢
1569,train,region,1,看回复气死了。最讨厌故作高素质高逼格的，不管台湾人，欧美人等等，有好人也有素质低的，遇到素质低当面骂自己的，当然要怼回去。怼回去就显得自己狭隘素质也不高?什么狗屁逻辑。要么去发达国家试试侮辱别人有啥后果?
750,train,gender,0,是吧，他的爱，还不够成熟，真伤脑筋，男孩子总是成长的太慢了，难得遇到合适又喜欢的
516,train,race,0,平等[飙泪笑][飙泪笑]，平等的接受资本家剥削，括弧不包括黑人，哈哈哈哈哈
2773,train,gender,0,女孩肉眼可见的累，司机心里说不出的苦
3500,train,region,0,东北话就不会这样了啊哈哈哈哈哈哈，东北话放气儿就不会误会了
1161,train,gender,0,司马懿女装都穿了还会怕尿裤子？
321,train,race,1,"所以这个数据可以用来打那些认为""女性收入不如男性所以要带孩子做家务""的人的脸，正是生孩子所以收入才低。这也是高层中女性少的一个原因，除了性别歧视，女性被生育耽误的那几年里，"
1322,train,gender,1,拉倒吧，事在人为，不管男女，只要你能力足够突出，家庭资源，社会资源自然向你倾斜，怎么可能歧视？大家都是傻的吗？
1634,train,gender,1,你是有多没有能力啊，自己买不起房子就算了，还这样诋毁女性
1759,train,region,1,我也遇到过北京人说自己北京人牛逼，别的省的人都垃圾，北京空气都他们污染的，一口京腔听的我这个恶心，因为他，我以后都对北京没好感
5580,train,race,1,所以 白人不是好东西啊 没解放让黑人当奴隶 解放了让黑人穷困潦倒 美国伟大不伟大？
6539,train,region,0,苏南的教师收入还是不错的。。苏北稍微差点了。。
11243,train,race,0,进化论的说法是我们黄种人进化的比白种人更完善一点，适应谷物但已经乳糖不耐受了
11624,train,race,0,同样是黄种人 日本最早也是靠规划来带动足球水平
2323,train,region,0,土库曼那个哪有什么考古报告、C14检测？也没有给中国人检测，全是欧洲人自己一言一行，那土城比中国新疆200年的土城都新
1555,train,gender,0,penformen没毛病当然是女孩子！
1051,train,race,0,支持黑人做总统
2291,train,region,0,浙江人表示也是这么个说话语序～被东北室友“嘲笑”到毕业～我觉得这样说话萌萌哒～
6198,train,race,1,白人让黑人自卑，却不敢报复，只能来欺负我们找自信了[发呆]
10985,train,race,0,我个人经常公派各国教育考察、学习。有次派到黑人区学校...怎么讲？谢不杀之恩。也有去类似蒙特梭利的学校。参加了蒙特梭利学校（类似学校联盟）在联合国（对！就是真的联合国）举办的模拟联合国。坐在中国席位上，我百感交集...
2797,train,gender,0,拉到吧，我们班第一是男的，高数，线代，统计，都是他带着我们班学，而且我们专业课小组合作讲评都是他分最高。
4842,train,gender,1,因为我看到的有的评论里，那些女权在批评男性禽兽时，是他们先上升到男性群体的。。
1287,train,region,0,开始怀疑淮北是河南的吃的东西相同的太多了
3171,train,gender,1,居然在知乎看到了校友666 我不赞同也不反对同性恋，但是很讨厌滥交gay或者说骗子宫的那种男的，真的太恶心了。
243,train,gender,0,女娲，感觉像个机器人一样..么得女神范...虽然我喜欢玩女娲
1744,train,race,0,但是在德国德语不是小语种啊，而且我在德国从小长大的朋友因为张了亚裔脸别人也是跟她说英语的，她只能用德语回过去。
7165,train,race,1,黑人自己都不重视教育，还需要别人瞎操心。
1137,train,race,0,然而作为一个中国人，我也分不清美国人的长相，差不多外国人对我来说就三种，黑种人，白种人，和中国人很像但还是能区分的黄种人……嘤嘤嘤
2577,train,gender,0,风女那么大的锅看不到？
1385,train,race,0,的确啊，很多中国人都想落叶归根，假如说想黑人，阿人一样真正的在法国生活，留下来很多人，积极地去做宣传而不是萌生发大财，从第一代到现在很多人一定会认可你是法国人。
3120,train,gender,1,阻止家暴阻止强奸犯的不是男人？哪个强奸犯不是被一大群大老爷们抓走的？不是男人阻止的是你阻止的？
4029,train,region,0,黑龙江人民来电表支持！⁽⁽ ( ´͈ ᗨ `͈ ) ⁾⁾
376,train,region,0,这是广东口音好吧
10249,train,race,0,只可惜死的太早了，不然肯定还有更多的精彩电影带给我们。如果说最能代表黄种人能文能武的我第一反应就是李小龙。
1198,train,gender,1,就事论事吧，别男权女权了，男女都有垃圾，这两年网上男女关系真的是很差，你骂zs是该的，但是别扯男权女权，容易引发别的扯皮
12606,train,race,0,去家里附近韩国大叔开的咖啡吃饭 他对我和对其他亚裔顾客总是蛮热情的
625,train,race,0,前年研电赛总决赛在你们学校，不过你们学校的黑人真多啊[惊喜][惊喜]
4434,train,race,1,这种警察不过是个例而已，美国的警察大部分还是很正常的，就跟中国的某些警察和当地黑色组织互相勾结祸害老百姓一样，个例说明不了整体。不想让人们出去也不用把外面描绘成地狱。
760,train,region,1,外地人分不清很正常，还有个三明的在知乎上吹牛东北人一听他就能听出来，所以说黑东北也正常，一听没有口音就立马给你定义成东北了。
217,train,gender,1,真的很讨厌截图里自称攻控的人。不看人品，不讲逻辑，是攻就喜欢，是受就反感。和现实里说男人就是高等，男人做什么都是对的有区别？恶心人。
5003,train,race,1,我一般情况下脾气挺好的，就是对私用他人物品这个事儿绝不能忍&lt;(｀^´)&gt;，感觉得天天和黑人小伙吵架了。。。
11652,train,race,0,"在India待过半年的来答,印度人确实用手指来清理屁股，但是商场酒店这些都是有卫生纸的.,一般小餐厅都是用手吃饭（这里的小餐厅指的是类似国内路边摊或者小街边店这种）但是在商场或者稍微上点档次的地方他们也用刀叉这种餐具（而且还有筷子）"
2486,train,region,1,从小在天津长大，不是我黑天津人，我认识这种混子天津人特别多。。当然了。。也可能是因为我认识的天津人比较多。。。
1208,train,gender,1,既然男女都适用，干嘛拿这些东西怼男生？女生没钱没房没车可以说“要娶我，你必须有房有车”。双标？女权癌？最看不惯这些zuo的女生
254,train,race,1,赞同！我多次提出，女性比男性享受更多假期和福利才是职场性别歧视的根源之一。
428,train,gender,0,你男朋友是脾气不好，爱抱怨，这样的人分了也好
12341,train,race,0,卡诗，威娜，黑人头，欧莱雅……看楼主没来我表脸答一下
870,train,gender,0,后面直接来了什么鬼，然后男主被寄生了之类的，我真的老人地铁手机。
10630,train,race,1,所以说你完全不了解美国社会现实。一个黑人，看起来就tm是个黑人，受到歧视时别人会说“你就是一半黑人我歧视你50%”吗？然后这个黑人说“我是黑人，我受到了XX歧视”时候一个白人跳出来了，
433,train,race,0,黄种人的话，最帅不过金城武。
3459,train,region,0,坐标那里呢？我在浙江永康，下个月要出差一个月，是有这个需求呢！很乖，它会埋屎，不挠人，就是太粘人。黑色狸花猫，带点白色，2个月大的样子
1080,train,region,1,其实我想说 别再老拿上海排外说事 每个地方排的只是素质很差的一拨外地人
4906,train,race,1,美国黑人又不都是奴隶后代，真正的奴隶后裔没混血的也很罕见了
8352,train,race,1,以为黑命贵能削弱美国而且支持是非常愚蠢的中美是两个人在冲突，而黑人运动是一种病毒，病毒能够害美国，也可以害中国。中国人支持黑命贵，并不能加强黑命贵坑害美国的能力，相反，只会让国人同情黑人，
1319,train,race,0,呵呵眼见为实，全国都知道广东人长相偏东南亚眼睛不大皮肤黑嘴巴暴，我就不解释了。但是作为湖南人要说一句湖南确实比广东人美眼睛大，而且少数民族地区基本都是双眼皮
7170,train,race,1,你言论有误，看不起黑人的观点应该受到尊重。毕竟知乎是中国的知乎，在中国的论坛里面看不起外国人难道不是正常合法合理的。需要你来判断？你够资格么？
106,train,gender,1,拉倒吧恶心死我了女主第一次随随便便给了个男的
3274,train,gender,0,是允许生而不是强制生，不要故意患被害妄想症，生不生绝对是自己的事情，对老板来说按时按量发薪水后就不欠员工什么。
3537,train,gender,1,我个人感觉是对性向的排斥度（？
10301,train,race,0,饮食主要控制油糖盐+碳水化物，所以整个中国的饮食习惯都差不多，而且单纯的辣椒等调料品是鼓励多用的，加强口味，减少对盐的依赖。印度人的饮食里最健康的部分就是咖喱，这些辛辣对健康有益。这些都是加拿大管方饮食指南的内容。
7865,train,race,1,白人歧视黄种人，你咋不思考这种现象为什么存在？歧视就是歧视，本来就是一种错误好吧。
3601,train,race,1,参照快船老板骂黑人的做法就行了
4697,train,gender,0,看了这个事故我只想说永远不要低估女生的能力
9875,train,race,0,但愿来世能托生外国，即便是黑人也行，最好是帅气高大金发碧眼的白人。
7048,train,race,1,怪别人歧视中国人，那么多中国人开挂，是不是还要别人夸中国人？种族歧视不是没有道理的。
4946,train,region,0,但是澳门很棒啊，我觉得关键是教育，尤其是教科书，就应该和大陆教科书一样，教育总目标什么的也和大陆一样，当然在其他方面他们可以坚持自己的原则理念，还要把台湾的教科书也换成大陆的
7391,train,race,1,歧视非洲人是有原因的，请问你感受过停在路边的车被咋是什么感觉吗？你能感受好好走在大街上被黑人拿枪指着抢劫是什么感觉吗？我的观点判断从来都来自自身经历，没有经历怎么会感同身受。
1049,train,region,1,你非要用自己的想法代替其他台湾人的想法，我看到你的同胞自己说的，在台湾的陆配绝大多数都过的不好，我们在台湾的陆配也说台湾人当面一套背后一套，就业孩子各种被歧视。你非要觉得歧视陆配比歧视穷人更尊重人，我无话可说
2692,train,gender,0,红发魔女不是死了吗
5596,train,race,1,在南非白人贫民窟很多，有些地方黑人不收留白人，歧视白人也很严重。
17,train,race,1,"严重到，大家会认为中国的平权已经不能更好了，女性地位已经过高了。,严重到，谈一下女性在职场受歧视，会被认为是在打拳。,严重到，哪怕在平均学历远超社会平均的知乎，简单的“穿衣自由”都能被找各种方向杠。,甚至，"
1468,train,gender,1,我觉得说女人就得以男人为中心的大男子主义的男人，特别恶心，没有人天生为你服务的，以为自己是太阳，所有人都得围着他转，真是醉了。
6559,train,race,1,中国人经常把种族、民族和国家的概念搞混，所以面对美国的种族歧视时经常产生“只要做得好人家就不会歧视我们，被歧视了一定是我们有问题”的误解[语塞]全然忘记了亚裔作为美国高收入高学历的种族，地位还远远不如低收入低学历高犯罪率的非裔呢。
7360,train,race,1,楼上基本把我想说的说完了，还有一点就是佩恩战打完之后樱哥给的那一拳，我满脸黑人问号，我记得是你们要保护鸣人吧，我记得你们是被打爆之后鸣人救场吧，那你有什么资格在鸣人疲惫不堪回来的时候打人家一拳还责备什么“让你乱来”？？？
2387,train,gender,0,有道理， 里面多少本子劳模。那肯定比女朋友好看。
4639,train,gender,1,菜b没资格喷人，越喷越杀，跟男女没关系
5494,train,race,1,这个真不一定，毕竟当初非洲也是奴隶制嘛 没道理不反抗黑人主子，大老远来了美洲就反抗白人主子
2890,train,region,0,我很尊重粤语，从外地移居广东后，也一直有在学。我只是不喜欢有的人虚空输出，所谓打压迫害。。。文化、魅力、传承，在就会一直在。也没见四川人山东人闹腾。 喜欢一个地方，自然而然就会去融入。更何况我觉得广东人已经是很随和包容的群体了
2543,train,gender,0,女神先低俗的
9371,train,race,0,并不，出斯大林可能性更大，因为现实决定不可能出希特勒，凯撒是掌握军权的，而军队里已经有大量黑人和拉美人了，所以从这个角度讲，要维护军队的稳定，只能是找这三者的共同目标，所以凯撒很大可能是真正看透本质的那种人，所以会是集合了特朗普理念和桑德斯想法的人。
1682,train,region,0,我哪见我说河南是南方了？河南是中原，你上学没学过吗？我已经工作了，我们部门五个人，最矮的我们领导，南方人。再说了，学生就不能代表了？南北方学生就不能代表南北方人了？ 给你数据你又说肉眼不明显，差距三厘米，那是平均差好吧，明不明显你不会自己转转看吗？
3774,train,region,0,参加北京高考的考生考得上华科还进不了北师吗？我15年参加湖北高考，够这两个学校的分，然后去了北师，虽然华科离家近
12627,train,race,0,嗯嗯，一般来说长得不一样，维吾尔族普遍比较像欧洲白人或者印度人长相，哈萨克族普遍是东亚人长相
12156,train,race,0,我觉得女子项目里之前比较正常之后越来越像男的女运动员都很有可能长期服药，大小威廉姆斯还有黑人体操选手拜尔斯刚参加比赛的年龄段都是女孩样子，之后都变成了金刚。
4510,train,region,0,那我不知道，我知道开化是浙江最穷的吧...你也苏啊？
1588,train,gender,1,当初出了这个新闻没多久刑法就改了，现在男的强奸男的也犯法
13263,train,race,0,第一个图我看到了死亡，是加纳黑人抬棺天团哈哈哈
3785,train,region,0,第一张图没啥问题啊，方言调查一般都是老派，很多年轻人都跟着北京叫了，他颜色太接近，你估计看成其他颜色了 发自知乎 For Windows 10
10624,train,race,1,黑人恶心，还是空姐行为恶心？
11211,train,race,0,印度人不吃牛肉身上也有味
2119,train,gender,1,这个案子不离奇好不好，只能说这男的女的傻，可怜这个撞见奸情的女滴
2646,train,gender,1,什么叫做 歧视女性 的传统文化？？？？？
2392,train,region,1,看到怕被说地域黑，就感觉是东北 🤦 ‍♀️
6201,train,region,0,我记得pp pp是福建宁德的好像 当时微博好像叫君了个君 操作细腻 思路清晰 主玩中单的 现在不知道去哪里了…
658,train,gender,1,最欺负丑女的就是男人。畜生一样。
3576,train,region,0,外婆，我们广西这边吧外婆叫婆婆
5390,train,race,1,任何一种政治正确，华人都不会成为受益方。。黑人欺负华人，那是应该的，白人只会看见猩猩斗猴子，华人反抗黑人，抱歉，那是种族歧视。。至于白人嘛，要考虑你大陆市场或者华人选票的，给个面子道个歉，不需要你大陆市场或者华人选票的，去你妈的Chink。
1714,train,gender,1,一群男人打仗不行，只能怪罪女人了。如果演电影也能算罪的话，那些演犯罪片的演员都该抓起来了。演得太像也诱导犯罪。废物就是废物，懦夫就是懦夫。永远要别人替你承担。
3479,train,gender,1,为什么炸？ 因为贤惠没有价值。
842,train,gender,0,我觉得你是个直女[捂脸]
2636,train,gender,1,是这样强奸罪要求暴力的手段行为女奸男在学术上不用强奸而是以求奸一次不是没有道理的
10467,train,race,0,黑人的表情和眼神，看的挺感人。
5309,train,region,0,太扯了吧，我们学校山西数一数二了，只需要双一流硕士就可以。
1446,train,region,1,你那个眼看见以偏概全了？他舍友没素质是个河南人这不是事实吗？他说所有河南人了？你在这喷什么？
4805,train,race,1,东南亚个别国家，比如越南，起码在人种上和我们是一样的，最该抵制的其实是非洲黑人！看看他们在美国的犯罪率以及因为种族矛盾而给美国带来的动荡和撕裂，简直让人不寒而栗
1420,train,gender,0,我遇到了你ex的女版有些女生也忘不了
2120,train,region,1,我只承认你们河南祖宗征服同化你们的时候，干了很多屠杀强暴之类的事情……你要是因为说犯罪率高我也没啥说的，但是别忘了你们是哪来的……
4350,train,gender,1,暴力能生出孩子吗，果然男人是个没脑子没生育能力的简单动物，更加没用了
8105,train,race,1,窃以为失败之处更多是电影本身的失败之处，隔壁琴厄索一样是女主角，塑造不要好太多，再说亚裔小妹这演员选的，堪称辱华了，选一个同等水准的白黑拉丁裔不还是一样要被骂。
528,train,region,1,这…是地域黑吧，河南的朋友怎么了，喷…很脏么，那你这么脆弱，为什么还要上来就骂别人疯了…
684,train,region,1,河南人专偷井盖这个谣言只是信息大爆炸时代的一个缩影而已！好多没有甄别能力的人以为河南就是偷井盖！
854,train,gender,0,这他大爷找什么男朋友啊还
5218,train,race,1,美国现代黑人，好多也只怕是女黑奴和白家主生的，男黑奴有多少留下后代，也是个迷 看看美洲黑人，往往没有非洲黑人黑，都带点棕色，就知道大都混过血，父系只怕也有不少是高贵的盎格鲁撒克逊，只是黑人的基因显性太强了，所以外观上都是黑人
834,train,region,0,东北经历了十四年艰苦的抗日斗争，这种情节是深深地烙印在东北人民的心里的，这男的要是在东北，真的走不了。
3132,train,race,1,呵呵，说你法盲你还不承认， 首先，啥叫中美都一样，美国是是海洋法体系，中国是社会主义法律体系。 其次，在明尼苏达州，规定强奸罪就是 有罪推论，这是为了保护妇女权益。
