Unnamed: 0,split,topic,label,TEXT
2803,train,region,0,上次看到一个贵阳市的高考生源少数民族加分的占50%，这太扯了，完全偏离里政策的初衷，同一个学校上学，然后一半人差别待遇。内蒙也一样，加分政策早该改革了，加分只应该是在教育水平在省内相对落后的地区进行
2057,train,gender,0,那会皇上还只是个王爷，离皇座八丈远，还没人顾虑的到一个宫女给他生孩子的事呢
1307,train,gender,1,我觉得骚扰女性的真的恶心，这打的真的解气
2594,train,race,0,是的 印度人
956,train,race,0,我一开始也一直很怕东南亚人 避开走 但是有一次我去香港 走公交车站 我其实在看走过去的帅哥 一个东南亚看起来很淳朴的女人以为我不知道该上哪辆车 一直在跟我说哪辆去哪里
5828,train,race,1,印度人在香港也算是弱势群体，经常被歧视的，敢那么拽的估计有黑社会背景（巴基斯坦和印度人很多）
1965,train,gender,1,田园男权就男权吧，总比田园舔狗强多了
8805,train,race,1,种种迹象表明这个病毒是从美国传过来的，中国人做了最好的防疫措施为什么要被歧视？你不找美国那些垃圾政客原因，垃圾政客故意引导美国对亚裔仇恨，亚裔不就是因为不反抗才被欺负？亚裔明明贡献什么都比黑人多，
6546,train,region,0,河北人，祖籍太原。家里平均一天一顿面，妈妈的手擀面。就算让我一年不吃米也不稀罕，但是一天不吃面就不舒服。上大学的时候南方同学还好奇我为啥天天去吃面。。。我说米饭吃了不禁饿。
958,train,region,1,所以你觉得这种人很多的论据是什么？你统计过数据？还是因为“你觉得这种人很多这种人就很多”？这么回答你觉得跟“偷井盖的人里河南人比较多所以所有河南人都喜欢偷井盖”有区别吗？用个别现象评价整个行业是理智的？
3846,train,race,1,自由社会应包容不同声音？别的不说，你在美国像香港人辱骂大陆人一样对黑人喊一句“黑鬼”，对犹太人喊一句“希特勒万岁”试试，看看美国会包容你这种不同声音不？ 嗯，连言论自由都不保障，和香港比美帝实在太不自由民主了。。。
6483,train,region,0,按照这个架势，大苏北每年都被批，南通根本就不用说了 ，我们当年的口号是学ben cha 中学
1429,train,region,1,没人无缘无故的惹人，像东北话里里的你瞅啥，打一起的都不是黑社会，毕竟都要弄钱呢，在这样一个法制社会，爱打架的黑社会都会被消灭，玩心眼，善于思考的赚钱才能存活，日本就是如此。
1570,train,gender,0,女朋友不爱他才是关键。爱一个是舍不得让他为难，跟他生气，不想亲热的。
962,train,region,0,湖南人表示 父辈丧失说平话的能力，我这辈已经丢失很多方言词汇，而珠三角的经济实力跟地域限制，让很多年轻人不用出省，以白话为（包括第二）母语的很多广府人（甚至广东人）把所有 北方人 看作一个天然的整体 他们都是说普通话长大的。
2213,train,race,0,去世博会的时候在非洲联合馆弄的~~~戒指是黑人大叔看我可爱让大娘白送的~~
2777,train,race,1,说实话，现在国内性别对立愈演愈烈，有点向韩国看齐，韩国那边甚至发展到出现杀男婴的极端女权组织和奸杀女性的极端男权组织。
3142,train,gender,1,那如果1号嫁给这种垃圾男人，最幸运的反而是2号和3号不是吗？
1752,train,region,1,旅游真好...河南听说骗子多 0 0
11229,train,race,0,中东那点战争都能打几十年，放在太祖打天下那个年代真是小场面而已……太祖当年面对的敌人有宗教势力、少数民族势力、军阀、国军、日本人……太多太多了。
7192,train,race,1,美国对亚裔的歧视招生也就是在本科，硕士美国人自己都不去读，再歧视亚裔就真招不到人了。何况本科歧视比较严重的也只是发生在少数顶尖学校，说句不好听的，就算不歧视也没几个能进去。
6040,train,region,0,hhhhh，山东财经大学欢迎你。
736,train,gender,0,哈哈哈哈哈帅哥你缺女朋友吗
9342,train,race,0,答主就是在那里读的书…且在南城给黑人提供过社工服务，谢谢
4989,train,region,0,学友哥在如果爱里面和烂片澳门风云三里面那种沉默的癫狂的感觉没几个人演的出来
9562,train,race,0,《中华人民共和国中医药法》第二条 本法所称中医药，是包括汉族和少数民族医药在内的我国各民族医药的统称，是反映中华民族对生命、健康和疾病的认识，具有悠久历史传统和独特理论及技术方法的医药学体系。请对着法律解释下，什么叫做现代中医。
686,train,region,1,不能再赞同，以前我觉得江苏人太强势自私，直到我遇到了广西人。我对广西人的印象：乡俗陋习很多，整体教育水平文化素质低下，民风彪悍，没什么本事但有股狠劲儿，骂人超难听
3163,train,region,0,作为每天洗澡的广东人，一天不洗浑身难受 ，这一个星期不洗……会死的吧。不敢想象
10689,train,race,1,嗯，现在就在国内。感觉非常不一样。国外有种族歧视，国内游地域歧视，但是中国还是很棒的
1556,train,gender,1,这男的威胁女生想死，他怎么还不去啊，去谢罪。
3124,train,region,1,陕西人都很傻，比较木讷，“陕西愣娃”
739,train,gender,0,他有一个男朋友？？男朋友的话就算了我不喜欢双性恋
1527,train,gender,0,女主最有名的片子 . ....被你华丽丽的无视了
2692,train,race,0,兄弟啊，中国都快进入女权社会了，还大男子主义呢
1606,train,race,0,哈哈哈哈哈黑人区转一圈可太顶了
313,train,race,1,好主意，这个回答能从根本上解决女性在职场上不受歧视，办法是有的，
2850,train,region,1,你的文章整体说的是对的。现在上海人没那么排外了。在上海不需要学上海话。
758,train,gender,0,男主角也有些拉垮
2277,train,gender,0,蒋雯丽演技好到让我超讨厌她演的《金婚》女主角。也许好演员给观众带来的代入感就是这样吧。
8260,train,race,1,首先呢，我承认了确实是我用词不当没表达清楚意思，不是说非去清北才算人，其次呢，我不觉得去哪都是祸害的黑人有什么个人能力（当然我也没有，所以我很有自知之明不去留学[大笑]），黑人为什么是祸害参考广州参考美国参考西欧各国参考日本为何拒绝黑人。
8460,train,race,1,不要拿黑人来作为种族歧视的例子，美国暴乱黑人乘火打劫根本就是暴徒，只是为了捞钱
498,train,region,1,听说上海的喵都排外，不知道是不是真的？手动滑稽
7971,train,race,1,黑人也是人，种族歧视恶心，想想多少中国人在海外别人不嫌弃我们，
4100,train,race,1,"说日语的教授，和人说话，句句不离“爹死/です”和“妈死/ます”，,在中国竟然还能安然无恙至今,黑命贵的内个梗，"
7717,train,race,1,反正就一句话。黑人来可以，别想黑化中国，我挺讨厌黑人。真的。不好意思，
10894,train,race,1,从个人形象上来看，中国女性形象普遍高于男性，无论是言谈举止还是穿衣打扮，或是整体形象！从学历教育上来看，在本身男多女少的基础上，接受高等教育的女生数量还是超越了男生，中国女生实在太优秀！无论从哪个方面来看，
4543,train,region,0,我查了一下数据：711全球共56003家店。其中中国：7135，具体城市为：北京177，天津57，成都59，上海74，重庆11，青岛28，广东708，香港928，澳门46，台湾5047。中国全家两千多家，上海全家是一千两百多家。
2373,train,race,0,对，中国人你想要去声援没有任何问题，本来就是普世价值，但是我感觉到是在要求，觉得中国人也有必要和义务去声援亚裔，性质是不一样的
1349,train,region,1,她们认同又能如何？中国的国籍不是那么好拿的！台湾，香港倒是中国人，你看看她们对内地人的歧视，根本就瞧不起我们！
8869,train,race,1,你别被美国那边舆论误导了，弗洛伊德事件之所以闹成没法收场其实早就超越其事件本身，而是美国这些年社会与种族矛盾的爆发。我们看待问题不能非黑即白，美国歧视黑人吗？歧视。黑人犯罪率高吗？高。种族之间公平吗？不公平。警察暴力执法了吗？
11729,train,race,0,输给日本人是再正常不过很好接受的，本来中日乒乓球界就融合很深，拿来类比不大恰当，就好像澳大利亚游泳输给英国一样是无所谓的。但你想想要是从现在开始中国乒乓球队一直被一个美国人或者印度人持续击败8年，让全世界都忘记掉中国乒乓球队，你就明白澳大利亚人现在的心态了
4429,train,race,1,你们总说韩国人看不起中国人，我实在是搞不懂他看不起的点在哪，他嗨的点在哪，论面积，论人口，论军力，除了人均GDP，当然这也是它小不能比，实在是搞不懂看不起中国人的嗨点在哪，这题还有这么多讨论，
593,train,region,1,没见过动不动就提打架的东北人，至于东北人名声怎么坏的，难道不是地域黑“努力”的结果，呵呵
1971,train,region,1,山东还出了个青年四人抢劫虐待杀死年轻夫妻的恶劣案件
2771,train,gender,1,不是说不招女博士吧，男人结了婚也要一样的去照顾小孩，只是相对来说比较少，当然我觉得这个师姐比较恶心了，利用他人劳动成果
178,train,region,1,郭德纲就是被天津人排挤去北京的好么，拿老郭自己的话说当时就想在北京当个虫。怎么现在又变成不是天津人不理解老郭了
13025,train,race,0,中日友谊靠运动会中韩友谊靠参拜日韩友谊靠中国威胁论
3951,train,race,1,不要把美国人民跟中国人民划等号，中国人民给人善良、温良的印象，而且手无寸铁，在暴力执法机关面前处于绝对弱势。美国人民可不是这样啊，美国人民是武装化的人民，而且性格彪悍，动不动就拿枪跟警察对着干。
6761,train,region,0,想抱抱答主 请一定好好爱你的老公孩子 他们是你真正的家人 不要过多纠结父母的亏欠了 我也是在号称最不重男轻女的东北 父母都是辽宁人 只不过我是独生女 即便如此 我依旧能感受到你姑姑的那种态度
5985,train,region,0,山东人，幼儿园被老师强塞两个馒头，从此除非饿死，馒头一概不碰。 反正本科，研究生，期间吃馒头次数一个手数的过来
2919,train,gender,0,男权话语体系中，男性无所谓贞操。
4612,train,gender,1,改了改了，不喜欢女的了。
7455,train,race,1,如果和基因人种无关，那是什么造成这些的？教育？我觉得让黑人接受教育是奇怪的
3886,train,region,0,但是也没见河南学生在大学有多强啊
1322,train,region,0,那种你别说广州，他说的湖北都出不去，别太阴谋论啦
5831,train,race,1,高级黑人和低级黑人真是割裂。就像在中国某些知识分子嘴里的中国普通劳动人民，愚昧无知没有信仰没有灵魂。
2645,train,gender,1,想不想我帮你列举一下亚男受到的歧视、不公和委屈？
807,train,gender,1,为什么不要男的。。。为什么要歧视我们这些汉子。。。
10245,train,race,0,特别是在澳洲，排队进考点的时候会发现很多都是欧洲人，新马人，印度人……等等等
380,train,region,1,其实基本都是外地人把你们骗去广西南部搞传销，因为比较落后，不太好找。so...广西背锅侠
1568,train,gender,0,野兽演技高于女主。ps：还是觉得带毛的野兽比较有吸引力，最后出现的真人有点僵啊。
1398,train,gender,1,这个女生太歹毒了
6012,train,region,0,山东。。。
1124,train,gender,1,外国女权，这活男人能干为什么女人不能干。中国女权，这活男人能干凭什么女人来干！
10965,train,race,0,这人名望很高，又是极少见的黑人川粉，必然是大新闻啊，而且是很好的子弹，现在懂王正在极力撇清关系呢
5114,train,region,0,可以的，只要是在上海本科学校的大一学生都行
9881,train,race,0,黄种人参加这种运动，就是用膝盖肌肉赌一把，对于黑人是众多比赛中的一场，对于黄种人很可能就是最后一场比赛
67,train,race,1,女性，尤其是未婚未育的女性，所受到的就业歧视，让女性很难积累自己的资本，政府把生育成本的锅甩给企业，企业不接，又不是企业的孩子，那这个锅只好女性自己扛，最后还是会转移到男性身上的。女生如果是独生女还好，
10747,train,race,0,她是澳大利亚裔，热忠于接澳大利亚出品的电影也能理解
166,train,region,0,北京户口好拿？
4048,train,region,0,东北指内蒙古东北部与东三省 山东离东北隔着一个渤海呢
4672,train,race,1,表示『我们相爱吧』这种真人秀完全毁三观。 最开始还不理解为什么节目组安排谁，那些嘉宾就刚好喜欢谁，不会有不对口不合适的么？？ 直到朋友告诉我里面好多嘉宾，生活中已经有了另一半，我？？？？？黑人问号
3018,train,region,1,？？？？江苏人莫名躺枪，请问你是哪里人？我可以说我被你这种人莫名其妙地域黑了后，骂你们那边人都是垃圾吗？
5551,train,region,0,前两天和一个印尼妹子聊天，说到上大学。我是四川人嘛，现在在湖南上大学。我跟她说我很羡慕她即使上大学都能每天回家。我的大学离家一千多公里。然后，她憋了好久，来了一句你家那里没有大学吗？！！！！！
12117,train,race,0,因为杨安泽跑出来让亚裔去迎合白种人的价值观，所以要cue他，
1279,train,race,0,印度人和中国人的发展方向不同，孔子说，未知生，焉知死，从根本上躲开了生死的讨论，终极的思索，所以后来佛教进入中国，填补了这一部分空白，收获了大批拥趸。
5847,train,race,1,1 一旦开始打砸抢会迅速将中立派推到对立面。2 另外黑人中已经没有真正意义上的领袖人物了，没有领袖就没有纪律。再多人也只是散沙。老美怕的可不是这些暴力的示威者。
474,train,region,1,什么特么东北口音多，这明显是他们为了追求所谓的搞笑去模仿东北口音，都快恶心死我了
660,train,gender,0,捉急。。我是说哪怕再尊重动物，狮子一流看到人类也是以一口咬来居多，所以没有动物园，我们的子女估计一辈子也见不到活的猛兽
1382,train,gender,1,想想两个男的去接吻和开房我就觉得非常恶心
4355,train,gender,1,男人要过了30没钱没本事没魅力又长得丑，那就不只是掉价的问题了。（微笑）
13144,train,race,0,第一张图片不是印度人哦 那位小姐姐是刚好去旅游[飙泪笑][飙泪笑]
3690,train,gender,1,当然现实，本人21，常被夸贤惠～捂脸逃走。
1862,train,gender,0,所以你认为答主能代表宅男？
2482,train,gender,1,都什么年代了！还有这种事！都说山东重男轻女，但也为见过这么苛刻自己女儿的！
5344,train,race,1,黑人在美国是被歧视还是优待的
658,train,region,1,广东人可没有你们宇宙苏的优越感，低调务实，来广东的外省人按规矩办事，广东人很接纳，搞破坏，素质差则称之为：北捞。
1624,train,region,1,不是，凭什么拿着浙江的教育去占其他地区的资源啊……这嘴脸也太恶心了吧
1539,train,gender,1,女体乘是要吃人？？？
2682,train,race,0,罗琳想表达的是在魔法世界，肤色，性取向这些东西相对开放很多，美国魔法国会的主席不就是黑人女性么
5572,train,race,1,抵制黑人！保护华夏血统！保护中国不成为黑人国家
5979,train,region,0,怕是对山东人有什么误解( ͒•·̫|
439,train,region,0,我来到河北读书，不过也不后悔（后悔也没用，自己选的[飙泪笑]），如果过些年空气依然不好，为了下一代，逃离也是没有办法的选择了。那些污染物对身体尤其是肺部的伤害基本是不可逆的。
6573,train,race,1,现在的核心问题是阿憨能不能代表全体亚裔？这才是最重要的，你可以说剧里唯一的亚裔让这么个人演，所以是歧视亚裔，我也可以说如果剧里出现更多的亚裔，而他们都是这种形象，这才是歧视，
539,train,race,0,朋友，海贼王了解一下？~哈哈哈哈是黑人小姐姐啦，特别好玩拉着我感叹了好久的中文太神奇
4972,train,gender,0,这个世界上有什么想法的都有，就和这个世界上有很多不喜欢洋娃娃的女性一样。没什么奇怪的。
186,train,gender,0,就这个男友把病人隐私公开在网上的做法，他但凡对病人有一点关心保护都不会这么做。
11977,train,race,0,对于黄种人来说，目前苏炳添就是短跑的天花板，管他有多高！
3891,train,region,0,来自河南北部的我来给你点赞证明，那个很好吃
643,train,race,0,如果就这种形式来说，中文从古代就以押韵著称，写出超级押韵的rap不是问题。关键是中国没有说唱的灵魂，大多数中国人听说唱真的就是听个新鲜，听个巧劲，听不出感情。没有黑人的生活环境，说唱就会流于表面。推荐一首lifes struggle，这就是有灵魂的中文说唱
1435,train,gender,1,这个男的凭什么还回来打人？
11029,train,race,0,当然是饿的啦，你们这些黄种人
2993,train,region,0,对头，如果对着一开始认识就用普通话的人就觉得非常自然，但是你让我对着说了很多年四川话的人突然说普通话，那真是太恼火了好嘛[捂脸]
1484,train,region,1,那是不是应该说“大多数中国香港人觉得这是歧视，那么这就是歧视”
1025,train,gender,0,大兄弟夜跑女教师新闻没看过啊没事别瞎晃悠大晚上0.0
12510,train,race,0,针对于黑人白人 通俗的来讲 如果你父母发现你球打的好 他们可能立刻会让你投入赛场上厮杀 但是在中国不同 你的父母会让你专心学习 且国家此时对运动并没有过多的着重 因为其实本身不管巅峰也好平凡也罢 运动最后所产生的职业经济效益并不多
7614,train,race,1,本来就是暗示亚裔呀，而且他也歧视亚裔。因为他的意思就是暗示“黑人考试要简单一点，黄人考试要难一点”，本来就是两家都有刻板印象。很多美华只想着跟黑人斗，
1747,train,region,0,哈哈哈哈哈哈哈那上海重庆真可怜啊
9783,train,race,0,奥巴马真的挺帅的好吗？连我妈这样的看不上黑人的老妇女都觉得他挺帅的。
10704,train,race,0,这是因为我们是蒙古黄种人 以前老师给我们科普过
190,train,region,1,您还是在北京………… 江西人民投来了巴望的眼神…… 现在咱江西文科生上三本都要五百多分（真心不低……） 然后今天还在知乎上看到个问题，读三本是不是垃圾人……
1952,train,race,0,这个人貌似是把白种人创造的文明都归为西方文明，黄种人创造的文明是东方文明
9833,train,race,0,天生长得细，黄种人骨骼也细
1731,train,gender,1,重男轻女，毁人一世。
676,train,gender,1,要是我就直接报警，猥亵妇女。
2316,train,region,0,你只是没有职业规划和坚持，我普通学校，四年之后，26岁考上985硕士，还不是一样年薪十几万，在上海，人生没你说的那么惨，全是比你惨的人
2598,train,gender,1,没有黄吗?伤钱又伤肾。还有网络女主播也不能碰。
3361,train,region,0,吉林省闷声发大财
10909,train,race,0,从血型比例上看，OB型血多的地区又贫穷，而且战乱频繁，A型血多的地区人民富裕社会稳定，A型血白人居多，O型血黑人居多，B型血黄种人和游牧民族居多，欧洲的吉普赛人和亚洲的蒙古人都是B型血居多，因为美洲土著O型血太多了而被A型血为主的白人消灭了，
3868,train,gender,0,当然是因为许多人对于“女权”的真正本质并不理解啊。
1734,train,gender,1,后面这组数据是想说明什么呢？无处不在的明显的隐晦的性别歧视大量萌生自杀念头但是却不是真的想自杀而男的自杀是因为真的想死？
1794,train,region,0,和好坏有啥关系，风俗口味而已，四川人不是喜欢吃辣么？东北人喜欢烤串。内蒙人爱喝酒不是很正常吗？杠着有意思吗？
7673,train,race,1,黑人真的大多数很恶心
7547,train,race,1,看完这部电影，我现在开始歧视黑人了。。。 太丑了
3454,train,region,0,普通医院做事很程序化和敷衍不管什么病，先验血再说。。除了儿童医院。。。不知道其他地方是不是这样。至少上海的大医院，医生一点都不忙，儿科和涉及重病的需要针对性治疗的才会比较忙吧。一般的外科和五官科，验血，开药。。。
11355,train,race,0,事实科学数据表明黄种人基因最强大，你那是刻板影响
1953,train,gender,1,碰到劫，男刀直接秒了还拉什么距离，
2707,train,gender,1,我想起很多年前有个辱母案，那男的把正在侮辱他母亲的讨债者杀了，被判刑。
12174,train,race,0,他之前给黑人小哥送金币送装备都是依赖水的
8266,train,race,1,我种族歧视，我承认，我就是歧视黑人，又怎样？
1054,train,gender,0,宗教都那样。前几年不还有大师给失足少女开光。
1411,train,region,1,咱能不能客观一点，不能有个山东人是小偷你就怀疑所有山东人是小偷，对不对？
2804,train,gender,0,LGBT这个问题大多数人都是报以包容开放的态度对待的，官方微博的负责人想必也是如此。
4946,train,gender,1,你说到了点子上。一个男的不抽烟不喝酒不出去耍，要是再不打个游戏，估计就是变态或者傻批
1452,train,region,1,我挺恶心那些黑河南的 我一般不会撕但是我有时候忍不住 我就想问问从哪看出来河南人偷井盖的 有具体报道没 不知道就不要乱说 显得自己没脑子 跟风 我河南人咋的你们了 就你们省人都是好的 可拉几儿倒吧 真的是 不觉得自己恶心么
6040,train,race,1,政府操刀，黑命贵思潮宣传，捧杀黑人，为了获得舆论支持，最后灭掉黑人。因为之前有个印象就是美国压迫黑奴，
9126,train,race,0,额………怎么说呢，这是印度人自己阻碍自己发展，挺好的。最好投资都别去印度，让他就这样保持个几十年
10539,train,race,0,个人觉得jay z还是比较帅的 可能我是喜欢这种脸型(好比我一直觉得james比较帅) 另外jay z还是很有才的，说唱界黑人是他 白人是eminem 这地位是难以撼动的
6094,train,region,0,宁大可是宁夏教育厅的亲儿子哟，只能说群众的眼睛那可都是练过的
11464,train,race,0,四川盛产D系小矮黑人
2514,train,region,0,我是台湾人。90年初去韩国的手续比去内地方便。不然我也比较想去哈尔滨
4289,train,gender,0,我也是小时候被当成男孩子养，剪短发和穿运动装哈哈哈
6299,train,region,0,甘肃5000美元，上海20000美元，上海人想象不到甘肃人生活环境多恶劣。
1303,train,region,1,幸好你在美国还有法律没人敢亵渎法律 我在中国看见新疆小偷见义勇为 而受伤 警察压根不管 去分局举报 警察差点没把我变成上访人员
11969,train,race,0,金川馆长和黑人还有山庄绷带蓝色古堡真的是吓死了！[惊讶]
8689,train,race,1,这政治正确玩的，真NM6。 剧黑农民了么？农民出身的官员确实有腐败现象能否认么？以后反腐剧里的坏人就必须是官二代城市人的身份咯？少民肯定也不行咯？女人LGBT黑人宗教人士肯定也都不行咯？ 一群白（黄？）左在下面跟着高潮也是醉了
45,train,region,1,最善于搞歧视的就是海外的福建人
3772,train,gender,1,30在即。 有个传统的拒绝接受新思想的妈，唯一没能按照她的期望去完成的人生步骤就是结婚（和男的），仅此而已。
415,train,race,0,黑人感觉很多都蛮好看的啊。。。。就是那种超级自信然后气场强到爆炸的感觉
1914,train,race,0,美帝将亚裔入学率调低了，把拉美裔和非裔黑人入学率平衡了，本朝嘛，符合条件的少民高考加20分，烈士子女10分。
1974,train,race,0,标准东南亚人长相
1905,train,region,0,怪不得我新疆人在外地吃哈密瓜。。。都觉得不甜。。原来品种都不一样
851,train,race,0,浅棕色头发看起来和亚裔肤色相近，远看有一种光头的感觉，不信你可以去看看死或生里有一个，发色几乎和肤色一样，还是短发，但那种皮肤特别白的亚裔就没有这种违和感，晒棕的欧美人也会这样。
4849,train,gender,0,算了算了，就算她认为是重男轻女，想要跟她父母平分半个房子的钱也不会有的，徒增烦恼罢了
4918,train,region,0,看你回答的比较多，请教一个问题：为什么这次暴乱的是香港，而不是赌博为业澳门
