Unnamed: 0,split,topic,label,TEXT
751,train,race,0,在欧美国家，亚裔绝对都是素质很高的那一档。
1849,train,region,1,东北雪乡导游打人事件了解一下
12343,train,race,0,美国黑人一半父系单倍群是R1a和I，可以说是给雅利安人了[机智]
4727,train,race,1,我吐了，我都怀疑这个角色就故意找这种贼目鼠眼的亚裔摸黑黄种人形象了，第六季带她逛总部的情节真的拉仇恨，恶心，演的还这么恶心
1030,train,region,1,作为一个河南人，教育确实一般。除了豫南几个学校就没能打的。
8056,train,race,1,所以你们觉得恶心的不是黑人，是中国女人[好奇]
5876,train,region,0,小时候看这段也很想吃荔浦芋头，湖北的芋头都很小的嫩芋头，从没见过这么大的芋头，有一年去海南，街边吃着海鲜看到叫买一份份的芋头条，觉得好奇点了一份，非常好吃，象特别粗的薯条沾糖吃还是外裹好了糖，时间太长记不清楚了，是用荔浦芋头切条做的。
9345,train,race,0,民族英雄呐，黄种人的骄傲……可惜一些宵小苍蝇只记得他摔倒的样子，摔碎了他们的玻璃心
7093,train,race,1,这种人就应该扔到黄浦江里，游上来了就有机会忏悔，游不上来只能怪自己没学好游泳了，你不教训他还真以为中国人好欺负吖，惯出来的毛病，在中外国人犯罪要加大惩罚力度才有威慑力，同理这种语言上歧视中国人，
218,train,region,0,文中说的 没到600分，智商不够就是不努力的借口 是指像北京这样教育比较发达的地区，不要拿偏远地区比如新疆西藏来说事，也不要拿江苏省来杠，人家总分都没有600。我写的时候就怕有人会跳出来说，既然评论里有人提了，那就再说明一下
8752,train,race,1,"害,如果他能代表黑人群体的话，那才是真正的侮辱吧[捂脸]不犯罪就难受"
11411,train,race,0,黑人是gay，哈哈哈哈，大快人心
2348,train,region,1,我也不懂你为什么会扯到低保啊牺牲河北养北京之类的。。。。。结果变成我是地域黑？？？（黑人问号脸）算啦你开心就好啦
11948,train,race,0,关键未来整出来上千亿人还要高质量生活就不一样了。黑人和印度人的生育能力不是盖的。。。
7914,train,race,1,不算吧。。。。群演嘛，演过尸体的那么多人，黄种人演难道就是歧视黄种人？
13123,train,race,0,印度人造的地下城应该比自然灾害更有效率。
10064,train,race,0,我觉得袁姗姗只是颜被大家诟病，演技真的还好。。。现代装漂亮多了。。。赵丽颖主要是被黑人品，但她也是新一代小花里公认演技不错的了，碾压唐嫣杨幂没问题~所以这俩人不太客观。。。我觉得换成baby吧，她真的是在刷脸，虽然确实美！
6759,train,region,0,我本人从未歧视过河南人。网络上经常有河南人的负面新闻，我想其实这些负面新闻其他地方的肯定都有过，可能是因为河南人口众多，外出人口也多，遍布全国各地，加上网络发达，传播迅速，所以导致河南人经常中枪
2830,train,gender,0,是的，女艺人看起来像个魔头
432,train,region,1,台湾骗子太多了，我们这台商一半是骗子。
179,train,gender,0,同一个花季少女超迷伍佰、林子祥这种大叔～有段时间听一直单曲循环浪人情歌把洒脱两字演绎的淋漓尽致
10179,train,race,0,他和给他点赞的都是印度人吧。
3984,train,race,1,"1，乔丹是个例，而且你说反了，像乔丹一样的杰出的黑人，不改变很多人对黑人这个总体的偏见,2，攀高枝瞧不起神马的，这不是歧视是啥？,3，我们在说天朝。,4，词汇也不少，黑鬼阿三之类不是专门用来种族歧视的么？"
1718,train,region,1,东北人说的都是东北话，为什么没人说他们歧视，因为大家都听得懂。一句话 语言是用来交流的，现在全国少说90%的人应该或多或少会说普通话或者带着口音的普通话吧，如果对方听不懂的情况下继续说方言，只能归结为说方言这人不想跟你多bb或者是素质堪忧了
3363,train,gender,1,抱歉啊，我是les里的海王。
5085,train,region,0,我也喜欢！我们江西的
5631,train,race,1,答主歧视别人的样子像极了他歧视的黑人歧视别人的亚子
10565,train,race,1,打住不要受到道德婊的影响，你的经历决定你的想法，你觉得黑人恶心那黑人就是恶心，他们没被摸，他们可以说风凉话嘲讽你。你不需要开导自己，他们的确就是恶心，仅此而已
1537,train,region,0,是的，我遇到的北京买家卖家还都是不错的，这个世界还是好人多。防范还是要的，但不能因为这个说面交不好。
10217,train,race,0,我在英国上学，在谢菲尔德大学，个人认为英国人还是挺好的，对人也温和有耐心，倒是别的国家的留学生，经常会对华人或者黑人做一些不礼貌的举动。我帮别人开门，英国人一定会说谢谢，上次有个黑人，居然跟我说不关我事，有点不能理解
3081,train,gender,1,我姥姥说她小时候鬼子去他们村炮台还是什么也不欺负那个村的老百姓还会给村里小孩糖吃有些鬼子欺负村里的女人女人就大喊班长小鬼子就吓跑了
1623,train,gender,1,只有外表但无内涵得女人只会让人越接触越觉恶心， 但反过来，则不同。
7527,train,race,1,你是黑人→非我族类→非我族类为我白人服务→歧视固化为“黑人低人一等”→劳动人民风吹日晒晒黑→大家都想做人上人→大家都厌恶作为“人下人”符号的黑皮肤妥妥的种族矛盾也是阶级矛盾
11790,train,race,0,昆仑奴就是指印度人或非洲人，黑皮肤特征明显，没什么错。
6528,train,region,0,柿饼 松饼 苏北 白山 鳖……三（水杯
4440,train,race,1,这是黄种人被压迫的表现，中国情况更差
3162,train,race,1,反了吧，南部黑人多，都学了一口南部口音
769,train,gender,0,我，美少女壮士，打你。๑ ๑
343,train,region,0,你告诉我上海哪个公务员能30w起，还是说你把市属管理的某所也当成公务员？
2637,train,gender,0,[思考]男的留账号你就帮玩，女的你就不管了。。。所以你是歧视嘛[捂脸]
12839,train,race,0,漫画和mcu的钢铁侠人设有很大不同，看过漫画的人绝不会喜欢钢铁侠，很多大事件都沦为搅屎棍，看的人想打他。所以内战电影直接改了剧情设定。至于黑人小女孩，漫画里早就出现了，就是钢铁之心，未来很可能列入mcu电影计划。
5113,train,race,1,让所有民族与黑人混血 资本至上 上层有固定的克隆技术和冻卵 接着开启新世界的大门 并奴役这些与黑人混血的孩子 真想很残忍
6429,train,race,1,美国人是看不起黑人的原因吧？
12181,train,race,0,中国留学生属于国际学生，有单独的名额，和亚裔土著的名额不相关。
1359,train,race,0,看了一篇文章认为：欧美人总有种赎罪心理，比如对难民，比如对黑人问题，推而广之就认为做善事必定就是因为有原罪。我觉得用在此处也算恰当
3588,train,region,0,在广西民大 每年都可以免费学壮语的
1530,train,region,1,就打个比方，山东人平均平均高，福建人平均身高矮，然后我福建人组个篮球队，山东人在那边说矮子里挑高个？这样合适？这样不会被干？装什么逼呢你？要来讲道理？你有理吗？
1872,train,race,0,不愧是黑人的信仰，素质还是可以的
601,train,gender,0,我是独女，而且爸妈很宠我，他们赚100万愿意给我90万那种，不过我公婆扣，我老公也没本事，所以我不好意思让我父母一直补贴我。
1067,train,gender,1,男人，垃圾 是客观事实嘛？这不是在输出负面情绪，在制造问题吗？
6160,train,region,0,我就是宁夏的哦，谢谢小姐姐喜欢我们的西瓜
2444,train,gender,0,如果没有心理问题，一个正常心理的女人不会自杀吧。更别说杀死自己的孩子了。
347,train,gender,1,中国的这些所有的女权。都丑。因为她们从来没有享受过一个漂亮女人得到的关心和爱。所以把这一切归咎于男人的打压。越极端的女权，越丑。
2521,train,race,0,一定是印度人
4674,train,region,0,辽宁在34个省级行政区 平均寿命排第八 怎么能说寿命短呢
1154,train,gender,1,女拳太带侮辱了，直接说那种反男女平权的不是女权就行了，还非要整个女拳来污名化女权
2742,train,region,0,本人是四川人，这应该是四川某个小县城上的方言，所以和大众印象里的成都话语调不太一样
3536,train,region,0,东北的房子给你你也不要啊[好奇][好奇]
1156,train,race,0,这是苹果手机那边的印度人，恰巧有一个比较懂中文！
5792,train,race,1,你可真是逻辑带师，说了中国好和坏，也说了欧洲好和坏，怎么就能证明爱因斯坦不是对中国有种族偏见了？我要是说黑人虽然愚蠢懒惰，但是体力好，也是有好有坏啊，这难道就不是歧视黑人了？
5495,train,race,1,暑假一栋宿舍楼这边抓过黑人小偷很会狡辩，也不知道遣送回去没。
2890,train,gender,1,两性关系中一般男性更主动，只要呼吁男性禁止婚前性行为，这种 隐藏的恶心 会大大的下降，离婚率也会大大降低，社会会更加和谐。
3089,train,region,1,莆田人都开莆田系医院
3317,train,gender,1,两个字，浪费。 或许高学历与低学历去学习家务技能的能力和实践水平确实有高低，可是家庭主妇这个既没有入行要求，没有行业标准。
1112,train,race,0,白族应该是中国南方各少数民族中文化程度最高的民族了吧？南方少数民族基本都在山沟沟里。但有过大理国几百年的历史沉淀，占据一片适合农耕的平原，发展程度不会差。
1424,train,region,1,同河北同二本同恶心！！
4154,train,gender,0,我心中唯一能和这部片抗衡的就是我的少女时代，但还是更喜欢这部一点点，为剧组疯狂打call
2227,train,race,0,十几年前我在人民广场看到一个女的搂着一个印度人，关键是那个印度人又爱又肥，长相猥琐，而那个女的却还不错，令人侧目，最近几年稍微好一些了，永康路拆掉之后洋人都转移了。
8322,train,race,1,那期不是洗黑人吧，分析了一下黑人受压迫的原因，然后指出这不是种族问题，同样底层白人也很惨，甚至在政治正确上还受黑人压迫，明明都有说啊
2995,train,region,1,妈的，一提网易新闻就来气。以前只有这个看新闻的app，我发现各种针对河南，引发网友骂战。真的恶心，给删了。
2476,train,region,1,我更愿意把偷井盖这个行为归为被迫的。河南以前不注重本省发展，加上河南的人口的基数太大了，十个穷人至少有一两个会小偷小摸，所以以前河南给大家印象很不好 小偷小摸是必然的
4650,train,region,0,我下了个增设特色兵种的文件，给很多国家加了新的特色兵种，比如中国有歼20，飞豹，99坦克，辽宁舰。美国有f22。但是伤害提高的太多了，即使增设了更强的防御工事，伤害也十分显著，有些打破平衡。不过倒是挺刺激的
1560,train,region,1,说觉得新疆不好的话本身就不对，原住民。。？你是歧视新疆人吧，我说你家乡怎么怎么不好还不准你反驳了？用“原住民的排挤”讽刺，真是可笑
8627,train,race,1,妈的智障 猩猩不服 不就毛多点吗 怎么不是黑人
3345,train,region,0,云南人说四川话[好奇]贵州人也说四川话[好奇]可以说这几个省都说西南官话，说是四川话表示有被冒犯到[发呆][为难][为难]
7257,train,race,1,答主也没说迫没迫害吧。奴隶主该迫害照旧迫害，但是出自对自己财产的关护就当时来说比起北方佬某种意义上还有点保障，但是黑人还是依旧被迫害不当人看呗，而且用不用机械和奴隶制是冲突的吗？
362,train,region,0,我湖北人，武汉上学呆过几年，毕业杭州呆过近2年，深有体会。
11359,train,race,0,不一定，我叶子菜从小到大吃过的绝对不超一斤，但是我肤色算挺白的，黄种人第二白的那一档差不多
2013,train,gender,0,关键是男孩子就更绝了
1758,train,region,1,"0 0结果发现我们没有被河南人民骗,但是被济南的旅行社给骗了"
125,train,gender,1,我觉得反了吧，凭什么女生就得温柔贤惠？？这个张扬个性的时代我很黄很暴力但我是好女孩，能这么想的是人权
5439,train,region,0,西北大地质系总感觉人少言微，在业内没啥地位。老一辈都知道西大很厉害，现在90后似乎很少有人知道西大地质系也是搞石油搞构造的
1695,train,region,1,骂人的我删的比较及时，所以你看不见啊。这个问题问的是为什么河南话土，主观问主观答，本来就没什么好说的，为什么不让我说？就是一群不允许我说土的人来引起我的注意，所以这种语气是必然的。既然你不好好说，那我也给你一样的待遇，我很公平的
1123,train,gender,1,同福建……重男轻女这事真的特别恶心
11809,train,race,0,其实在很多老外眼里黄种人都是一个样儿
2718,train,race,1,前几年法国拍的《岳父岳母真难当》，主人公老夫妻，仨女婿分别是阿拉伯人、犹太人和华人，晚宴的时候阿拉伯女婿和犹太女婿话不投机，吵了起来。华人女婿劝架，结果两个在吵架的连襟反而一起针对他，大致说虽然他们有矛盾，但还知道对方想啥，
4431,train,gender,1,像你这种思想龌蹉的老男人，聪明女人是不会搭理你的。看到你只觉恶心
13093,train,race,0,黑人不能穿带荧光色的衣服我是深表赞同的，就如同夜空中最亮的星!
1429,train,gender,1,最凶狠的男人，就是自残还要还手！
8800,train,race,1,我也没办法。。。我根本就是想一带而过。我不加地名人家说我编，加了地名说我地域黑。我真服了，本来没有什么地域黑成分，给生生弄成地域黑了。跟白左的歧视黑人一个尿性。
5042,train,race,1,纵观美国历史，民主党推行的歧视黑人的法案远多于共和党及其前身，甚至还是蓄奴的最大支持者。现在跳出来假惺惺的维护黑人权益还能得到一大帮黑人的支持，是不是说明黑人的记忆只有7秒？
2351,train,region,0,个人觉得没必要。。。新疆昼夜温差太大了。我一福建人觉得夏天晚上要穿外套出门。。。兵团其实很有钱，只不过不能随意拨款，总之就是要学生吃苦，不过学校附近租房贼便宜。。。
9755,train,race,0,顺便很巧的是，印度人认为印度餐也是世界数一数二的，咖喱的使用神乎其神，问题是，你爱吃吗？
1074,train,region,1,我就是说了下人们黑东北的原因，我从没在网上说过黑东北和河南人的话，我说的这些原因不管是不是真的，但是很多黑东北人的人都是这么想的
3466,train,race,1,第五条，印度人已经这么饥不择食了？
7073,train,race,1,结果玩了没两天就看到区里有人刷喇叭说我是骗子（黑人问号？？）
12741,train,race,0,相当于现在美国有德裔黑人日裔华裔的军队骨干
1227,train,region,1,不管做了什么 北京的jc一般上来就是先这么威胁当事人，让你自动乖乖地接受调解!
1060,train,gender,0,小姐姐，嘴巴张大哈气的都是凡人，她们仙女不管吃到什么都是通过卖萌来消化的
182,train,region,0,what？迪士尼是上海政府掏了地？那请问中国哪不是政府的地？
4857,train,gender,1,是啊，我也看不出来这和男女有屁关系，这种事也能打出女权炮我也是醉了。
4539,train,gender,1,你错了女性没有强奸这个罪，她们最多只能是强制猥亵侮辱，所以这一次我们男性应该站出来气抖冷[飙泪笑][飙泪笑][飙泪笑]
9203,train,race,0,多种原因造成的，可能体型天正原因也有～白人总体身高和骨架确实比黄种人更大…
7640,train,race,1,同意，中国不欠黑人，希望黑人报复欧美，别来中国。
5012,train,region,0,江西吗[好奇][好奇]，，
3332,train,gender,1,你能想象到吗，在这个穿了个乞丐裤，街坊四邻都得指着你唠两句说不检点的城市，如果知道lgbt这种人群的存在。
1293,train,gender,1,我私信可没骂他，是他自己装弱势群体，一想他真的是男的吗？男的真的这么会装？
2619,train,region,0,福建人表示米粉有粗米粉也有细米粉，细米粉我们也喊粉丝吃起来比较脆弹不容易断，米线是细的吃起来比较绵容易断，南方米粉种类真的蛮多的，从粗到细都有哦。
2889,train,region,1,我就算你抽样也可以，你看到数据了么？没看到数据你怎么就敢说是“事实”？你所谓的“事实”是自己愿意相信的“事实”，还是真实数据支持的“事实”？摸摸自己良心再说话行不行？这就跟地图炮说什么河南人偷井盖，广东人什么都吃，黑人智商低，在你们眼里都是tmd“事实”
8444,train,race,1,"美国歧视黑人是上世纪70年代之前的事情，现在黑人的地位已经过高，也就是过度政治正确了。,被枪杀的黑人弗洛伊德本身就有犯罪前科，曾因贩毒、非法持枪和私闯民宅数次被捕，还是个新冠病毒携带者，2020年五月警察抓他是因为他制作假货。"
3575,train,region,0,可是我室友东北妹子看起来萌萌哒我们南方人反而对她很温柔在她面前我开始还不好意思飙脏话。。。
11949,train,race,0,中国人确切的说并不是黄皮肤，在最早的马可波罗之类的人写的书里中国人是白皮肤的，黄皮肤本来是欧洲人对中国人的污蔑，只是恰好黄色在中国是尊贵的颜色，被中国人甘之如饴了。一般的外国人，应该不算南亚东南亚人，在印度算刹帝利。
2668,train,race,0,亚裔女性嗜好找白男，这是一种印象
239,train,region,1,“上海女朋友还是不要想了，你也看不上她，她也看不上你。上海人和外地人基本无解。” 这句赞。是真的。。。而且那种互相看不上是无解的，无关乎地域歧视。
3043,train,gender,0,[飙泪笑]我看了全集，反正看这个就是不能带脑子，男主帅沙雕玛丽苏就完事了。我就知道会有人来吐槽片尾这个，我当时也是给整蒙圈了[飙泪笑][飙泪笑]
2578,train,region,1,无规矩不成方圆。人吃人建国后也不是没有，人性不值钱的。一是教育缺失，二是官方不作为，才形成某些地方这种特色。如果把新疆反恐的劲使这，我不信打压不下去。杀鸡儆猴
2761,train,gender,0,分手了。这么对女朋友怎么还会分手
852,train,race,0,这个真是感动了，黑人兄弟来回刷爆几遍了，感谢汉化组
10300,train,race,0,印度人认为在公共场合亲是伤风败俗的，你这么说我也看过很多跳舞时抱来抱去啊船戏啊，然后世界是无所不能的，我最近在b站上看到一部尺度大的印度mv........
2263,train,region,1,... 觉得假钱的，去对冠字码，成都所有ATM 都可以，难道是江苏太落后？
2401,train,region,0,有一个答案里有写，是英文manhole传到日文然后再传到东北的。
1646,train,region,0,我爷爷经常跟我说这个，东北农村，低标准那一年差点饿死，吃淀粉，吃玉米骨，硬生生挺过来。
4008,train,gender,0,开头女朋友，结尾老婆[思考]
2554,train,region,1,山东人就是山东人，傻缺就是傻缺——我不觉得我在地域黑
2160,train,race,0,哆啦A梦相当于日本国粹级人物了，比美国拍的非洲片高多了，美国因政治正确，尬吹黑人，能好看？
3956,train,gender,1,那是不是所有女性公众人物都不好看
612,train,region,0,只能说，辽宁的民生供应单位，胆子也大到无法无天的地步了！
2110,train,region,1,这个不算乳法吧？本来就是事实，而且多用于比喻其他人或事了。又不是单单说法国媒体墙头草何来乳法之说？小部分苏联笑话也是如此。成语郑人买履也没人说是对河南几市的地域黑或者侮辱吧？歧视某些人或地和用某事来表达观点可不一样。
5008,train,region,0,上次在一个股票群听一个江西的游资讲课，他自己说一年至少50%，我相信在今年他们能翻几倍。今年玩的太狠了
5647,train,region,0,有没有天津医院的排名呀～
3651,train,gender,0,PhD，觉得社会培养了自己这么久，绝对不是为了让自己只为家庭服务的~~~
12915,train,race,0,我觉得印度人太多是bug越来越多的首要原因
1247,train,gender,1,想起失巧里面熏子的内心 ，女人都是很恶心的生物啊，所以爽太你一定要小心啊
2686,train,region,0,这个很正常啊，他在大连出生的，在大连度过的童年。现在还有人看籍贯说自己是哪里人吗？他爹是四川人，他是大连人没毛病啊。你自己想想。说自己是四川人才奇怪吧。
5827,train,region,0,没有黑美国，只是吹捧了新加坡，韩国和香港。
4240,train,gender,0,恭喜你，你男朋友和你是一类人，就够了！
11481,train,race,0,你买一盒就知道了，知乎上不少人买过。我自己跟印度小哥也聊了一下。相比国内药贩子，我更相信印度人。。。
1128,train,gender,0,早说了，别看键政做一个毛选又一个乌合之众的，正儿八经实操还得看女拳
569,train,gender,0,好难过好想哭，越是善良的人越容易受伤害，虽然我是个唯物主义者，但这样的情况我仍想既无奈又自欺的说，希望这世界有天堂，希望天堂里的他和他的妻女不再受到伤害。
10095,train,race,0,答主说的真的挺对的黄种人就该长这样这是特色啊
310,train,region,1,真正在澳大利亚呆的久的人才会真正体会，所谓的歧视，只是我们想太多。就想外地人来北京一样，老外之间也是互相怼的，不是只针对你
9218,train,race,0,我遇见的绝大多数老外都会想知道你的中文名是什么，并努力的学会。所以现在大部分我的同事同学都是用自己的中文拼音名，更不要提我见过的几乎大部分韩日印度人都是用自己的原名了。
117,train,gender,0,还有tt。女朋友。车。房子。孩子。
664,train,region,1,价值观健全的人，不会上升到山东省和山东人层面，但也不会不对山大从此有“偏见”。 填志愿时，或多或少都会掂量一下，毕竟，这事儿太恶心。 雪崩面前，没有一片雪花是无辜的。尤其是诸位山大学生。。
210,train,region,1,哈哈哈哈不好意思河南人一身黑了，初恋河南的，一样的恶心
4676,train,race,1,什么鬼。。答主有事吗？你说印度强奸的比例其实很低，没你们说的高，一方面又承认印度人口多，请问答主你觉得比例小就很值得不被非议了吗？难道这些案件不是看被强奸基数的吗？
1406,train,region,1,我就说了下重庆人普遍比较不讲普通话这事，一群不明事理的重庆人就跳出来对我各种人身地域攻击，报团取暖群起而攻之，您睁大眼睛看清楚咯，到底谁在地域黑？？！颠倒是非黑白挺爽的，是吧您？？
6453,train,race,1,黑人受到的歧视和亚裔受到的歧视是不一样的。黑人就是被认为是低等人，犯罪智商低。亚裔可能更像是一种嫉妒和排斥。亚裔受歧视比较多的是教育，亚裔上学难因为你学习太好了破坏平衡。
437,train,race,0,易帝的天赋在黑人里也是中上，身体素质很好
764,train,region,0,那是不是所有交大教授的研究成果、成绩都不代表上海交大了？成绩要算，出事了就切割，不厚道吧？
8214,train,race,1,我非常讨厌黑豹的剧情和瓦坎达这个国家，不是歧视黑人，而是太假了。
11525,train,race,0,扎克伯格媳妇，黄种人，（是不是华人不知道）颜值顶多5分。 这是不是能说明有趣的灵魂，一点不比好看的皮囊差？
583,train,gender,0,明明有199兰若庭，那么多平价白菜汉服，非要为了 仙 买山寨的仙女服。穿盗版用盗版理直气壮的人，跟他们讲什么道理啊？
5198,train,race,1,"在黑人骂人的问题下，说了个""尼""字，被封号一天，"
4642,train,region,0,1.少将只有退休和被抓没有转业，2.辽宁号舰长是大校军衔
417,train,race,0,说来也科学，黄种人1.7身高的身体协调性是最好的，可塑性最高。
1918,train,region,1,你这回答，活该有人黑东北
10546,train,race,1,怒赞，日本人眼中的我们何尝不是中国人眼中的印度人
250,train,gender,0,明明是6万多，小仙女别客气
2976,train,gender,1,她新男友当时尴尬了，估计在想能把人恶心吐了的女人到底要不要得
2715,train,gender,1,你哪来的幻觉没有欺凌啊？之前都有记者采访他们的同学，说男方确实是有欺负女孩子。你多看几个回答不行吗？上面都有说。
9912,train,race,0,都是天堂。别怪上帝偏心，大多印度人活着就是在地狱了。[思考]
9020,train,race,1,吧主应该去把那种脑残给封了。恶心死人的粉，黑人炒作，还故装作无意做的。
